symbol,name,country,ipo_year,sector,industry
KEX,Kirby Corporation Common Stock,United States,,Consumer Discretionary,Marine Transportation
KEY,KeyCorp Common Stock,United States,,Finance,Major Banks
KEYS,Keysight Technologies Inc. Common Stock,United States,2014,Industrials,Industrial Machinery/Components
KFRC,Kforce Inc. Common Stock,United States,1995,Consumer Discretionary,Professional Services
KFY,Korn Ferry Common Stock,United States,1999,Consumer Discretionary,Diversified Commercial Services
KGC,Kinross Gold Corporation Common Stock,Canada,2001,Basic Materials,Precious Metals
KGS,Kodiak Gas Services Inc. Common Stock,United States,2023,Utilities,Natural Gas Distribution
KHC,The Kraft Heinz Company Common Stock,United States,,Consumer Staples,Packaged Foods
KIDS,OrthoPediatrics Corp. Common Stock,United States,2017,Health Care,Medical/Dental Instruments
KIM,Kimco Realty Corporation (HC) Common Stock,United States,,Real Estate,Real Estate Investment Trusts
KIND,Nextdoor Holdings Inc. Class A Common Stock,United States,,Technology,Computer Software: Programming Data Processing
KKR,KKR & Co. Inc. Common Stock,United States,,Finance,Investment Managers
KKRS,KKR Group Finance Co. IX LLC 4.625% Subordinated Notes due 2061,United States,2021,,
KLAC,KLA Corporation Common Stock,United States,1980,Technology,Electronic Components
KLC,KinderCare Learning Companies Inc. Common Stock,,2024,Consumer Discretionary,Other Consumer Services
KLG,WK Kellogg Co Common Stock,United States,2023,Consumer Staples,Packaged Foods
KLIC,Kulicke and Soffa Industries Inc. Common Stock,Singapore,,Technology,Semiconductors
KLTR,Kaltura Inc. Common Stock,United States,2021,Technology,Computer Software: Prepackaged Software
KMB,Kimberly-Clark Corporation Common Stock,United States,,Consumer Discretionary,Containers/Packaging
KMDA,Kamada Ltd. Ordinary Shares,Israel,2013,Health Care,Biotechnology: Pharmaceutical Preparations
KMI,Kinder Morgan Inc. Common Stock,United States,2011,Utilities,Natural Gas Distribution
KMPB,Kemper Corporation 5.875% Fixed-Rate Reset Junior Subordinated Debentures due 2062,United States,2022,Finance,Property-Casualty Insurers
KMPR,Kemper Corporation,United States,,Finance,Property-Casualty Insurers
KMT,Kennametal Inc. Common Stock,United States,,Industrials,Industrial Machinery/Components
KMX,CarMax Inc,United States,,Consumer Discretionary,Retail-Auto Dealers and Gas Stations
KN,Knowles Corporation Common Stock,United States,2014,Consumer Staples,Consumer Electronics/Appliances
KNF,Knife Riv Holding Co. Common Stock,United States,2023,Industrials,Mining & Quarrying of Nonmetallic Minerals (No Fuels)
KNSA,Kiniksa Pharmaceuticals International plc Class A Ordinary Shares,United States,2018,Health Care,Biotechnology: Pharmaceutical Preparations
KNSL,Kinsale Capital Group Inc. Common Stock,United States,,Finance,Property-Casualty Insurers
KNTK,Kinetik Holdings Inc. Class A Common Stock,United States,2022,Utilities,Natural Gas Distribution
KNX,Knight-Swift Transportation Holdings Inc.,United States,2017,Industrials,Trucking Freight/Courier Services
KO,Coca-Cola Company (The) Common Stock,United States,,Consumer Staples,Beverages (Production/Distribution)
KODK,Eastman Kodak Company Common New,United States,,Consumer Discretionary,Industrial Machinery/Components
KOF,Coca Cola Femsa S.A.B. de C.V.  American Depositary Shares each representing 10 Units (each Unit consists of 3 Series B Shares and 5 Series L Shares),Mexico,1993,Consumer Staples,Beverages (Production/Distribution)
KOP,Koppers Holdings Inc. Common Stock,United States,2006,Basic Materials,Forest Products
KOS,Kosmos Energy Ltd. Common Shares (DE),Bermuda,2011,Energy,Oil & Gas Production
KR,Kroger Company (The) Common Stock,United States,,Consumer Staples,Food Chains
KRC,Kilroy Realty Corporation Common Stock,United States,1997,Real Estate,Real Estate Investment Trusts
KREF,KKR Real Estate Finance Trust Inc. Common Stock,United States,2017,Real Estate,Real Estate Investment Trusts
KRG,Kite Realty Group Trust Common Stock,United States,2004,Real Estate,Real Estate Investment Trusts
KRMN,Karman Holdings Inc. Common Stock,,2025,Industrials,Military/Government/Technical
KRNT,Kornit Digital Ltd. Ordinary Shares,Israel,2015,Industrials,Industrial Machinery/Components
KRNY,Kearny Financial Corp Common Stock,United States,2005,Finance,Savings Institutions
KRO,Kronos Worldwide Inc Common Stock,United States,,Industrials,Major Chemicals
KROS,Keros Therapeutics Inc. Common Stock,United States,2020,Health Care,Biotechnology: Pharmaceutical Preparations
KRP,Kimbell Royalty Partners Common Units Representing Limited Partner Interests,United States,2017,Energy,Oil & Gas Production
KRT,Karat Packaging Inc. Common Stock,United States,2021,Industrials,Plastic Products
KRUS,Kura Sushi USA Inc. Class A Common Stock,United States,2019,Consumer Discretionary,Restaurants
KRYS,Krystal Biotech Inc. Common Stock,United States,2017,Health Care,Biotechnology: Biological Products (No Diagnostic Substances)
KSPI,Joint Stock Company Kaspi.kz American Depository Shares,Kazakhstan,2024,,
KSS,Kohl's Corporation Common Stock,United States,1992,Consumer Discretionary,Department/Specialty Retail Stores
KT,KT Corporation Common Stock,South Korea,,Telecommunications,Telecommunications Equipment
KTB,Kontoor Brands Inc. Common Stock ,United States,2019,Consumer Discretionary,Apparel
KTF,DWS Municipal Income Trust,United States,1988,Finance,Finance Companies
KTOS,Kratos Defense & Security Solutions Inc. Common Stock,United States,,Industrials,Military/Government/Technical
KURA,Kura Oncology Inc. Common Stock,United States,,Health Care,Biotechnology: Pharmaceutical Preparations
KVUE,Kenvue Inc. Common Stock,United States,2023,Consumer Discretionary,Specialty Chemicals
KVYO,Klaviyo Inc. Series A Common Stock,United States,2023,Technology,Computer Software: Prepackaged Software
KW,Kennedy-Wilson Holdings Inc. Common Stock,United States,,Finance,Real Estate
KWR,Quaker Houghton Common Stock,United States,,Industrials,Major Chemicals
KYMR,Kymera Therapeutics Inc. Common Stock,United States,2020,Health Care,Biotechnology: Biological Products (No Diagnostic Substances)
KYN,Kayne Anderson Energy Infrastructure Fund Inc.,United States,2004,Finance,Finance/Investors Services
L,Loews Corporation Common Stock,United States,,Finance,Property-Casualty Insurers
LAB,Standard BioTools Inc. Common Stock,United States,2011,Industrials,Biotechnology: Laboratory Analytical Instruments
LAC,Lithium Americas Corp. Common Shares,Canada,2023,Basic Materials,Metal Mining
LAD,Lithia Motors Inc. Common Stock,United States,,Consumer Discretionary,Retail-Auto Dealers and Gas Stations
LADR,Ladder Capital Corp Class A Common Stock,United States,2014,Real Estate,Real Estate Investment Trusts
LAMR,Lamar Advertising Company Class A Common Stock,United States,1996,Real Estate,Real Estate Investment Trusts
LANC,Lancaster Colony Corporation Common Stock,United States,,Consumer Staples,Packaged Foods
LAND,Gladstone Land Corporation Common Stock,United States,1993,Real Estate,Real Estate Investment Trusts
LANDM,Gladstone Land Corporation 5.00% Series D Cumulative Term Preferred Stock,United States,,Real Estate,Real Estate Investment Trusts
LANDO,Gladstone Land Corporation 6.00% Series B Cumulative Redeemable Preferred Stock,United States,,Real Estate,Real Estate Investment Trusts
LANDP,Gladstone Land Corporation 6.00% Series C Cumulative Redeemable Preferred Stock,United States,,Real Estate,Real Estate Investment Trusts
LAR,Lithium Argentina AG Common Shares,Canada,2023,Basic Materials,Metal Mining
LASR,nLIGHT Inc. Common Stock,United States,2018,Technology,Semiconductors
LAUR,Laureate Education Inc. Common Stock,United States,2017,Real Estate,Other Consumer Services
LAZ,Lazard Inc. Common Stock,Bermuda,2005,Finance,Investment Managers
LB,LandBridge Company LLC Class A Shares Representing Limited Liability Company Interests,,2024,Energy,Oil & Gas Production
LBRDA,Liberty Broadband Corporation Class A Common Stock,United States,,Telecommunications,Cable & Other Pay Television Services
LBRDK,Liberty Broadband Corporation Class C Common Stock,United States,,Telecommunications,Cable & Other Pay Television Services
LBRDP,Liberty Broadband Corporation Series A Cumulative Redeemable Preferred Stock,United States,,Telecommunications,Cable & Other Pay Television Services
LBRT,Liberty Energy Inc. Class A common stock,United States,2018,Energy,Oilfield Services/Equipment
LBTYA,Liberty Global Ltd. Class A Common Shares,United Kingdom,,Telecommunications,Cable & Other Pay Television Services
LBTYB,Liberty Global Ltd. Class B Common Shares,United Kingdom,,Telecommunications,Cable & Other Pay Television Services
LBTYK,Liberty Global Ltd. Class C Common Shares,United Kingdom,,Telecommunications,Cable & Other Pay Television Services
LC,LendingClub Corporation Common Stock,United States,2014,Finance,Finance: Consumer Services
LCID,Lucid Group Inc. Common Stock,United States,,Consumer Discretionary,Auto Manufacturing
LCII,LCI Industries,United States,1995,Consumer Discretionary,Auto Parts:O.E.M.
LDI,loanDepot Inc. Class A Common Stock,United States,2021,Finance,Finance: Consumer Services
LDOS,Leidos Holdings Inc. Common Stock,United States,,Technology,EDP Services
LE,Lands' End Inc. Common Stock,United States,,Consumer Discretionary,Clothing/Shoe/Accessory Stores
LEA,Lear Corporation Common Stock,United States,,Consumer Discretionary,Auto Parts:O.E.M.
LECO,Lincoln Electric Holdings Inc. Common Shares,United States,,Industrials,Industrial Machinery/Components
LEG,Leggett & Platt Incorporated Common Stock,United States,,Consumer Discretionary,Home Furnishings
LEGH,Legacy Housing Corporation Common Stock (TX),United States,2018,Consumer Discretionary,Homebuilding
LEGN,Legend Biotech Corporation American Depositary Shares,United States,2020,Health Care,Biotechnology: Pharmaceutical Preparations
LEN,Lennar Corporation Class A Common Stock,United States,,Consumer Discretionary,Homebuilding
LENZ,LENZ Therapeutics Inc. Common Stock,United States,2021,Health Care,Biotechnology: Biological Products (No Diagnostic Substances)
LEO,BNY Mellon Strategic Municipals Inc. Common Stock,United States,1987,Finance,Trusts Except Educational Religious and Charitable
LEU,Centrus Energy Corp. Class A Common Stock,United States,2014,Industrials,Mining & Quarrying of Nonmetallic Minerals (No Fuels)
LEVI,Levi Strauss & Co Class A Common Stock,United States,2019,Consumer Discretionary,Apparel
LFMDP,LifeMD Inc. 8.875% Series A Cumulative Perpetual Preferred Stock,United States,,Health Care,Medical/Nursing Services
LFST,LifeStance Health Group Inc. Common Stock,United States,2021,Health Care,Medical/Nursing Services
LFUS,Littelfuse Inc. Common Stock,United States,,Energy,Electrical Products
LGIH,LGI Homes Inc. Common Stock,United States,2013,Consumer Discretionary,Homebuilding
LGND,Ligand Pharmaceuticals Incorporated Common Stock,United States,,Health Care,Biotechnology: Pharmaceutical Preparations
LGTY,Logility Supply Chain Solutions Inc. Common Stock,United States,,Technology,Computer Software: Prepackaged Software
LH,Labcorp Holdings Inc. Common Stock,United States,,Health Care,Medical Specialities
LHX,L3Harris Technologies Inc. Common Stock,United States,,Industrials,Industrial Machinery/Components
LI,Li Auto Inc. American Depositary Shares,China,2020,Consumer Discretionary,Auto Manufacturing
LIF,Life360 Inc. Common Stock,United States,2024,,
LII,Lennox International Inc. Common Stock,United States,1999,Industrials,Industrial Machinery/Components
LILA,Liberty Latin America Ltd. Class A Common Stock,United States,,Telecommunications,Cable & Other Pay Television Services
LILAK,Liberty Latin America Ltd. Class C Common Stock,United States,,Telecommunications,Cable & Other Pay Television Services
LIN,Linde plc Ordinary Shares,United States,,Industrials,Major Chemicals
LINC,Lincoln Educational Services Corporation Common Stock,United States,2005,Real Estate,Other Consumer Services
LIND,Lindblad Expeditions Holdings Inc. Common Stock,United States,2013,Consumer Discretionary,Transportation Services
LINE,Lineage Inc. Common Stock,United States,2024,Real Estate,Real Estate Investment Trusts
LION,Lionsgate Studios Corp. Common Shares,United States,,Consumer Discretionary,Movies/Entertainment
LITE,Lumentum Holdings Inc. Common Stock,United States,,Telecommunications,Telecommunications Equipment
LIVN,LivaNova PLC Ordinary Shares,United Kingdom,,Health Care,Biotechnology: Electromedical & Electrotherapeutic Apparatus
LKFN,Lakeland Financial Corporation Common Stock,United States,,Finance,Major Banks
LKQ,LKQ Corporation Common Stock,United States,2003,Consumer Discretionary,Motor Vehicles
LLY,Eli Lilly and Company Common Stock,United States,,Health Care,Biotechnology: Pharmaceutical Preparations
LLYVA,Liberty Media Corporation Series A Liberty Live Common Stock,United States,,Industrials,Broadcasting
LLYVK,Liberty Media Corporation Series C Liberty Live Common Stock,United States,,Industrials,Broadcasting
LMAT,LeMaitre Vascular Inc. Common Stock,United States,2006,Health Care,Medical/Dental Instruments
LMB,Limbach Holdings Inc. Common Stock,United States,,Consumer Discretionary,Engineering & Construction
LMND,Lemonade Inc. Common Stock,United States,2020,Finance,Property-Casualty Insurers
LMNR,Limoneira Co Common Stock,United States,,Consumer Staples,Farming/Seeds/Milling
LMT,Lockheed Martin Corporation Common Stock,United States,,Industrials,Military/Government/Technical
LNC,Lincoln National Corporation Common Stock,United States,,Finance,Life Insurance
LND,Brasilagro Brazilian Agric Real Estate Co Sponsored ADR (Brazil),Brazil,,Consumer Staples,Farming/Seeds/Milling
LNG,Cheniere Energy Inc. Common Stock,United States,2001,Utilities,Oil/Gas Transmission
LNN,Lindsay Corporation Common Stock,United States,,Industrials,Industrial Machinery/Components
LNT,Alliant Energy Corporation Common Stock,United States,,Utilities,Power Generation
LNTH,Lantheus Holdings Inc. Common Stock,United States,2015,Health Care,Biotechnology: In Vitro & In Vivo Diagnostic Substances
LNW,Light & Wonder Inc. Common Stock,United States,,Technology,EDP Services
LOAR,Loar Holdings Inc. Common Stock,United States,2024,Industrials,Military/Government/Technical
LOB,Live Oak Bancshares Inc. Common Stock,United States,2022,Finance,Major Banks
LOCO,El Pollo Loco Holdings Inc. Common Stock,United States,2014,Consumer Discretionary,Restaurants
LOGI,Logitech International S.A. Ordinary Shares,United States,1997,Technology,Computer peripheral equipment
LOMA,Loma Negra Compania Industrial Argentina Sociedad Anonima ADS,Argentina,2017,Industrials,Building Materials
LOPE,Grand Canyon Education Inc. Common Stock,United States,2008,Real Estate,Other Consumer Services
LOVE,The Lovesac Company Common Stock,United States,2018,Consumer Discretionary,Other Specialty Stores
LOW,Lowe's Companies Inc. Common Stock,United States,,Consumer Discretionary,RETAIL: Building Materials
LPA,Logistic Properties of the Americas Ordinary Shares,,2024,Finance,Real Estate
LPG,Dorian LPG Ltd. Common Stock,United States,2014,Consumer Discretionary,Marine Transportation
LPL,LG Display Co Ltd AMERICAN DEPOSITORY SHARES,South Korea,2004,Technology,Industrial Machinery/Components
LPLA,LPL Financial Holdings Inc. Common Stock,United States,2010,Finance,Investment Bankers/Brokers/Service
LPRO,Open Lending Corporation Common Stock,United States,,Finance,Finance: Consumer Services
LPX,Louisiana-Pacific Corporation Common Stock,United States,,Basic Materials,Forest Products
LQDA,Liquidia Corporation Common Stock,United States,2018,Health Care,Biotechnology: Pharmaceutical Preparations
LQDT,Liquidity Services Inc. Common Stock,United States,2006,Consumer Discretionary,Business Services
LRCX,Lam Research Corporation Common Stock,United States,1984,Technology,Industrial Machinery/Components
LRN,Stride Inc. Common Stock,United States,,Real Estate,Other Consumer Services
LSAK,Lesaka Technologies Inc. Common Stock,South Africa,,Finance,Investment Bankers/Brokers/Service
LSCC,Lattice Semiconductor Corporation Common Stock,United States,,Technology,Semiconductors
LSPD,Lightspeed Commerce Inc. Subordinate Voting Shares,Canada,,Technology,Computer Software: Prepackaged Software
LSTR,Landstar System Inc. Common Stock,United States,1993,Industrials,Trucking Freight/Courier Services
LTC,LTC Properties Inc. Common Stock,United States,,Real Estate,Real Estate Investment Trusts
LTH,Life Time Group Holdings Inc. Common Stock,United States,2021,Consumer Discretionary,Hotels/Resorts
LTM,LATAM Airlines Group S.A. American Depositary Shares (each representing two thousand (2000) shares of Common Stock),Chile,2024,Consumer Discretionary,Air Freight/Delivery Services
LU,Lufax Holding Ltd American Depositary Shares each representing two (2) Ordinary Shares,China,,Finance,Finance: Consumer Services
LUCK,Lucky Strike Entertainment Corporation Class A Common Stock,United States,2021,Consumer Discretionary,Services-Misc. Amusement & Recreation
LULU,lululemon athletica inc. Common Stock,Canada,2007,Consumer Discretionary,Apparel
LUMN,Lumen Technologies Inc. Common Stock,United States,,Telecommunications,Telecommunications Equipment
LUNG,Pulmonx Corporation Common Stock,United States,2020,Health Care,Medical/Dental Instruments
LUNR,Intuitive Machines Inc. Class A Common Stock,United States,2021,Industrials,Industrial Machinery/Components
LUNRW,Intuitive Machines Inc. Warrants,United States,2021,Industrials,Industrial Machinery/Components
LUV,Southwest Airlines Company Common Stock,United States,,Consumer Discretionary,Air Freight/Delivery Services
LVRO,Lavoro Limited Class A Ordinary Shares,Brazil,,Consumer Discretionary,Other Specialty Stores
LVS,Las Vegas Sands Corp. Common Stock,United States,2004,Consumer Discretionary,Hotels/Resorts
LVWR,LiveWire Group Inc. Common Stock,United States,2022,Consumer Discretionary,Motor Vehicles
LW,Lamb Weston Holdings Inc. Common Stock ,United States,2016,Consumer Staples,Packaged Foods
LWAY,Lifeway Foods Inc. Common Stock,United States,,Consumer Staples,Packaged Foods
LX,LexinFintech Holdings Ltd. American Depositary Shares,China,2017,Finance,Finance: Consumer Services
LXFR,Luxfer Holdings PLC Ordinary Shares,United Kingdom,2012,Industrials,Major Chemicals
LXP,LXP Industrial Trust Common Stock (Maryland REIT),United States,,Real Estate,Real Estate Investment Trusts
LXU,LSB Industries Inc. Common Stock,United States,2003,Industrials,Major Chemicals
LYB,LyondellBasell Industries NV Ordinary Shares Class A (Netherlands),Netherlands,,Industrials,Major Chemicals
LYFT,Lyft Inc. Class A Common Stock,United States,2019,Consumer Discretionary,Business Services
LYG,Lloyds Banking Group Plc American Depositary Shares,United Kingdom,,Finance,Commercial Banks
LYTS,LSI Industries Inc. Common Stock,United States,1985,Consumer Discretionary,Building Products
LYV,Live Nation Entertainment Inc. Common Stock,United States,,Consumer Discretionary,Services-Misc. Amusement & Recreation
LZ,LegalZoom.com Inc. Common Stock,United States,2021,Technology,EDP Services
LZB,La-Z-Boy Incorporated Common Stock,United States,,Consumer Discretionary,Home Furnishings
LZM,Lifezone Metals Limited Ordinary Shares,Isle of Man,,Basic Materials,Metal Mining
LZMH,LZ Technology Holdings Limited Class B Ordinary Shares,China,2025,Technology,EDP Services
M,Macy's Inc Common Stock,United States,,Consumer Discretionary,Department/Specialty Retail Stores
MA,Mastercard Incorporated Common Stock,United States,2006,Consumer Discretionary,Business Services
MAA,Mid-America Apartment Communities Inc. Common Stock,United States,1994,Real Estate,Real Estate Investment Trusts
MAC,Macerich Company (The) Common Stock,United States,1994,Real Estate,Real Estate Investment Trusts
MAG,MAG Silver Corporation Ordinary Shares,Canada,,Basic Materials,Precious Metals
MAGN,Magnera Corporation Common Stock,United States,2000,Basic Materials,Paper
MAIN,Main Street Capital Corporation Common Stock,United States,2007,Finance,Finance/Investors Services
MAN,ManpowerGroup Common Stock,United States,,Consumer Discretionary,Professional Services
MANH,Manhattan Associates Inc. Common Stock,United States,1998,Technology,Computer Software: Prepackaged Software
MANU,Manchester United Ltd. Class A Ordinary Shares,United Kingdom,2012,Consumer Discretionary,Services-Misc. Amusement & Recreation
MAR,Marriott International Class A Common Stock,United States,,Consumer Discretionary,Hotels/Resorts
MARA,MARA Holdings Inc. Common Stock,United States,,Technology,EDP Services
MAS,Masco Corporation Common Stock,United States,,Industrials,Industrial Specialties
MASI,Masimo Corporation Common Stock,United States,2007,Health Care,Biotechnology: Electromedical & Electrotherapeutic Apparatus
MAT,Mattel Inc. Common Stock,United States,,Consumer Discretionary,Recreational Games/Products/Toys
MATV,Mativ Holdings Inc. Common Stock,United States,,Basic Materials,Paper
MATW,Matthews International Corporation Class A Common Stock,United States,1994,Telecommunications,Metal Fabrications
MATX,Matson Inc. Common Stock,United States,,Consumer Discretionary,Marine Transportation
MAX,MediaAlpha Inc. Class A Common Stock,United States,2020,Consumer Discretionary,Business Services
MAZE,Maze Therapeutics Inc. Common Stock,United States,2025,Health Care,Biotechnology: Biological Products (No Diagnostic Substances)
MBC,MasterBrand Inc. Common Stock,United States,2022,Consumer Discretionary,Home Furnishings
MBIN,Merchants Bancorp Common Stock,United States,2017,Finance,Major Banks
MBINM,Merchants Bancorp Depositary Shares Each Representing a 1/40th Interest in a Share of 8.25% Fixed-Rate Reset Series D Non-Cumulative Perpetual Preferred Stock,United States,,Finance,Major Banks
MBINN,Merchants Bancorp Depositary Shares Preferred Series C,United States,,Finance,Major Banks
MBLY,Mobileye Global Inc. Class A Common Stock,Israel,2022,Technology,Computer Software: Prepackaged Software
MBNKP,Medallion Bank Fixed-to-Floating Rate Non-Cumulative Perpetual Preferred Stock Series F,United States,2019,Finance,Commercial Banks
MBUU,Malibu Boats Inc. Class A Common Stock,United States,2014,Industrials,Marine Transportation
MBWM,Mercantile Bank Corporation Common Stock,United States,1998,Finance,Major Banks
MBX,MBX Biosciences Inc. Common Stock,United States,2024,Health Care,Biotechnology: Pharmaceutical Preparations
MC,Moelis & Company Class A Common Stock,United States,2014,Finance,Investment Managers
MCB,Metropolitan Bank Holding Corp. Common Stock,United States,2017,Finance,Major Banks
MCBS,MetroCity Bankshares Inc. Common Stock,United States,2019,Finance,Major Banks
MCD,McDonald's Corporation Common Stock,United States,,Consumer Discretionary,Restaurants
MCHP,Microchip Technology Incorporated Common Stock,United States,1993,Technology,Semiconductors
MCI,Barings Corporate Investors Common Stock,United States,,Finance,Trusts Except Educational Religious and Charitable
MCK,McKesson Corporation Common Stock,United States,,Health Care,Other Pharmaceuticals
MCO,Moody's Corporation Common Stock,United States,,Finance,Finance: Consumer Services
MCRI,Monarch Casino & Resort Inc. Common Stock,United States,1993,Consumer Discretionary,Hotels/Resorts
MCS,Marcus Corporation (The) Common Stock,United States,,Consumer Discretionary,Movies/Entertainment
MCW,Mister Car Wash Inc. Common Stock,United States,,Consumer Discretionary,Automotive Aftermarket
MCY,Mercury General Corporation Common Stock,United States,,Finance,Property-Casualty Insurers
MD,Pediatrix Medical Group Inc. Common Stock,United States,,Health Care,Hospital/Nursing Management
MDB,MongoDB Inc. Class A Common Stock,United States,2017,Technology,Computer Software: Prepackaged Software
MDGL,Madrigal Pharmaceuticals Inc. Common Stock,United States,2007,Health Care,Biotechnology: Pharmaceutical Preparations
MDLZ,Mondelez International Inc. Class A Common Stock,United States,,Consumer Staples,Packaged Foods
MDT,Medtronic plc. Ordinary Shares,United States,,Health Care,Biotechnology: Electromedical & Electrotherapeutic Apparatus
MDU,MDU Resources Group Inc. Common Stock (Holding Company),United States,,Industrials,Mining & Quarrying of Nonmetallic Minerals (No Fuels)
MDXG,MiMedx Group Inc Common Stock,United States,,Health Care,Biotechnology: Pharmaceutical Preparations
MEDP,Medpace Holdings Inc. Common Stock,United States,2016,Health Care,Biotechnology: Commercial Physical & Biological Resarch
MEG,Montrose Environmental Group Inc. Common Stock,United States,2020,Consumer Discretionary,Professional Services
MEI,Methode Electronics Inc. Common Stock,United States,,Technology,Electrical Products
MELI,MercadoLibre Inc. Common Stock,Argentina,2007,Consumer Discretionary,Business Services
MEOH,Methanex Corporation Common Stock,Canada,,Industrials,Major Chemicals
MERC,Mercer International Inc. Common Stock,Canada,,Basic Materials,Paper
MESO,Mesoblast Limited American Depositary Shares,Australia,2015,Health Care,Biotechnology: Biological Products (No Diagnostic Substances)
MET,MetLife Inc. Common Stock,United States,2000,Finance,Life Insurance
META,Meta Platforms Inc. Class A Common Stock,United States,2012,Technology,Computer Software: Programming Data Processing
METC,Ramaco Resources Inc. Class A Common Stock,United States,2017,Energy,Coal Mining
METCB,Ramaco Resources Inc. Class B Common Stock,United States,,Energy,Coal Mining
METCL,Ramaco Resources Inc. 9.00% Senior Notes due 2026,United States,,Energy,Coal Mining
MFA,MFA Financial Inc.,United States,,Real Estate,Real Estate Investment Trusts
