symbol,name,country,ipo_year,sector,industry
PKX,POSCO HOLDINGS INC. American Depositary Shares (Each representing 1/4th of a share of Common Stock),South Korea,1994,Industrials,Steel/Iron Ore
PL,Planet Labs PBC Class A Common Stock,United States,2021,Technology,Radio And Television Broadcasting And Communications Equipment
PLAB,Photronics Inc. Common Stock,United States,1987,Technology,Semiconductors
PLAY,Dave & Buster's Entertainment Inc. Common Stock,United States,2014,Consumer Discretionary,Restaurants
PLD,Prologis Inc. Common Stock,United States,,Real Estate,Real Estate Investment Trusts
PLMR,Palomar Holdings Inc. Common stock,United States,2019,Finance,Property-Casualty Insurers
PLNT,Planet Fitness Inc. Common Stock,United States,2015,Consumer Discretionary,Hotels/Resorts
PLOW,Douglas Dynamics Inc. Common Stock,United States,2010,Industrials,Construction/Ag Equipment/Trucks
PLPC,Preformed Line Products Company Common Stock,United States,,Industrials,Water Sewer Pipeline Comm & Power Line Construction
PLSE,Pulse Biosciences Inc Common Stock (DE),United States,2016,Health Care,Medical/Dental Instruments
PLTK,Playtika Holding Corp. Common Stock,Israel,2021,Technology,EDP Services
PLTR,Palantir Technologies Inc. Class A Common Stock,United States,,Technology,Computer Software: Prepackaged Software
PLUG,Plug Power Inc. Common Stock,United States,1999,Energy,Industrial Machinery/Components
PLUS,ePlus inc. Common Stock,United States,1996,Technology,Retail: Computer Software & Peripheral Equipment
PLXS,Plexus Corp. Common Stock,United States,,Technology,Electrical Products
PLYA,Playa Hotels & Resorts N.V. Ordinary Shares,Netherlands,,Consumer Discretionary,Hotels/Resorts
PLYM,Plymouth Industrial REIT Inc. Common Stock,United States,2017,Real Estate,Real Estate Investment Trusts
PM,Philip Morris International Inc Common Stock,United States,,Health Care, Medicinal Chemicals and Botanical Products 
PMM,Putnam Managed Municipal Income Trust Common Stock,United States,1989,Finance,Investment Managers
PMO,Putnam Municipal Opportunities Trust Common Stock,United States,1993,Finance,Finance Companies
PMT,PennyMac Mortgage Investment Trust Common Shares of Beneficial Interest,United States,2009,Real Estate,Real Estate Investment Trusts
PMTS,CPI Card Group Inc. Common Stock,United States,,Consumer Discretionary,Publishing
PMTU,PennyMac Mortgage Investment Trust 8.50% Senior Notes due 2028,United States,2023,Real Estate,Real Estate Investment Trusts
PNC,PNC Financial Services Group Inc. (The) Common Stock,United States,,Finance,Major Banks
PNFP,Pinnacle Financial Partners Inc. Common Stock,United States,,Finance,Major Banks
PNFPP,Pinnacle Financial Partners Inc. Depositary shares of Pinnacle Financial Partners Inc. each representing a 1/40th Interest in a share of its 6.75% Fixed-Rate Non-Cumulative Perpetual Preferred Stock Series B,United States,,Finance,Major Banks
PNNT,PennantPark Investment Corporation Common Stock,United States,2022,Finance,Finance: Consumer Services
PNR,Pentair plc. Ordinary Share,Switzerland,,Industrials,Industrial Machinery/Components
PNRG,PrimeEnergy Resources Corporation Common Stock,United States,,Energy,Oil & Gas Production
PNTG,The Pennant Group Inc. Common Stock ,United States,,Health Care,Medical/Nursing Services
PNW,Pinnacle West Capital Corporation Common Stock,United States,,Utilities,Electric Utilities: Central
PODD,Insulet Corporation Common Stock,United States,2007,Health Care,Medical/Dental Instruments
PONY,Pony AI Inc. American Depositary Shares ,China,2024,Technology,EDP Services
POOL,Pool Corporation Common Stock,United States,1995,Consumer Discretionary,Industrial Specialties
POR,Portland General Electric Co Common Stock,United States,,Utilities,Electric Utilities: Central
POST,Post Holdings Inc. Common Stock,United States,2012,Consumer Staples,Packaged Foods
POWI,Power Integrations Inc. Common Stock,United States,1997,Technology,Semiconductors
POWL,Powell Industries Inc. Common Stock,United States,,Energy,Electrical Products
POWWP,AMMO Inc. 8.75% Series A Cumulative Redeemable Perpetual Preferred Stock,United States,,Industrials,Ordnance And Accessories
PPBI,Pacific Premier Bancorp Inc,United States,,Finance,Major Banks
PPC,Pilgrim's Pride Corporation Common Stock,United States,,Consumer Staples,Meat/Poultry/Fish
PPG,PPG Industries Inc. Common Stock,United States,,Consumer Discretionary,Paints/Coatings
PPL,PPL Corporation Common Stock,United States,,Utilities,Electric Utilities: Central
PPT,Putnam Premier Income Trust Common Stock,United States,1988,Finance,Finance Companies
PPTA,Perpetua Resources Corp. Common Shares,Canada,,Basic Materials,Precious Metals
PR,Permian Resources Corporation Class A Common Stock,United States,2022,Energy,Oil & Gas Production
PRA,ProAssurance Corporation Common Stock,United States,,Finance,Property-Casualty Insurers
PRAA,PRA Group Inc. Common Stock,United States,2002,Finance,Finance: Consumer Services
PRAX,Praxis Precision Medicines Inc. Common Stock,United States,2020,Health Care,Biotechnology: Pharmaceutical Preparations
PRCH,Porch Group Inc. Common Stock,United States,2020,Technology,Computer Software: Prepackaged Software
PRCT,PROCEPT BioRobotics Corporation Common Stock,United States,2021,Health Care,Medical/Dental Instruments
PRDO,Perdoceo Education Corporation Common Stock,United States,,Real Estate,Other Consumer Services
PRG,PROG Holdings Inc. Common Stock,United States,,Consumer Discretionary,Diversified Commercial Services
PRGO,Perrigo Company plc Ordinary Shares,United States,,Health Care,Biotechnology: Pharmaceutical Preparations
PRGS,Progress Software Corporation Common Stock (DE),United States,1991,Technology,Computer Software: Prepackaged Software
PRH,Prudential Financial Inc. 5.950% Junior Subordinated Notes due 2062,United States,2022,Finance,Life Insurance
PRI,Primerica Inc. Common Stock,United States,2010,Finance,Life Insurance
PRIM,Primoris Services Corporation Common Stock,United States,,Industrials,Water Sewer Pipeline Comm & Power Line Construction
PRK,Park National Corporation Common Stock,United States,1994,Finance,Major Banks
PRKS,United Parks & Resorts Inc. Common Stock,United States,2013,Health Care,Biotechnology: Electromedical & Electrotherapeutic Apparatus
PRLB,Proto Labs Inc. Common stock,United States,2012,Industrials,Metal Fabrications
PRM,Perimeter Solutions SA Common Stock,Luxembourg,,Industrials,Major Chemicals
PRMB,Primo Brands Corporation Class A Common Stock,United States,2024,Consumer Staples,Beverages (Production/Distribution)
PRME,Prime Medicine Inc. Common Stock,United States,2022,Health Care,Biotechnology: Biological Products (No Diagnostic Substances)
PRO,PROS Holdings Inc. Common Stock,United States,2007,Technology,EDP Services
PROK,ProKidney Corp. Class A Ordinary Shares,United States,2021,Health Care,Biotechnology: Biological Products (No Diagnostic Substances)
PRS,Prudential Financial Inc. 5.625% Junior Subordinated Notes due 2058,United States,2018,Finance,Life Insurance
PRSU,Pursuit Attractions and Hospitality Inc. Common Stock,United States,,Consumer Discretionary,Business Services
PRTA,Prothena Corporation plc Ordinary Shares,United States,,Health Care,Biotechnology: Pharmaceutical Preparations
PRTC,PureTech Health plc American Depositary Shares,United States,,Health Care,Biotechnology: Pharmaceutical Preparations
PRTH,Priority Technology Holdings Inc. Common Stock,United States,2016,Consumer Discretionary,Business Services
PRU,Prudential Financial Inc. Common Stock,United States,2001,Finance,Life Insurance
PRVA,Privia Health Group Inc. Common Stock,United States,2021,Health Care,Medical/Nursing Services
PSA,Public Storage Common Stock,United States,,Real Estate,Real Estate Investment Trusts
PSEC,Prospect Capital Corporation Common Stock,United States,2004,Finance,Finance: Consumer Services
PSF,Cohen & Steers Select Preferred and Income Fund Inc. Common Stock,,2010,Finance,Investment Managers
PSFE,Paysafe Limited Common Shares,,2021,Consumer Discretionary,Business Services
PSIX,Power Solutions International Inc. Common Stock,United States,,Industrials,Industrial Machinery/Components
PSMT,PriceSmart Inc. Common Stock,United States,,Consumer Discretionary,Department/Specialty Retail Stores
PSN,Parsons Corporation Common Stock,United States,2019,Technology,EDP Services
PSNY,Polestar Automotive Holding UK PLC Class A ADS,Sweden,,Consumer Discretionary,Auto Manufacturing
PSNYW,Polestar Automotive Holding UK PLC Class C-1 ADS (ADW),Sweden,,Consumer Discretionary,Auto Manufacturing
PSO,Pearson Plc Common Stock,United Kingdom,,Consumer Discretionary,Books
PSTG,Pure Storage Inc. Class A Common Stock,United States,2015,Technology,Electronic Components
PSTL,Postal Realty Trust Inc. Class A Common Stock,United States,2019,Real Estate,Real Estate Investment Trusts
PSX,Phillips 66 Common Stock,United States,,Energy,Integrated oil Companies
PTA,Cohen & Steers Tax-Advantaged Preferred Securities and Income Fund Common Shares of Beneficial Interest,United States,2020,Finance,Trusts Except Educational Religious and Charitable
PTC,PTC Inc. Common Stock,United States,,Technology,Computer Software: Prepackaged Software
PTCT,PTC Therapeutics Inc. Common Stock,United States,2013,Health Care,Biotechnology: Pharmaceutical Preparations
PTEN,Patterson-UTI Energy Inc. Common Stock,United States,1993,Energy,Oil & Gas Production
PTGX,Protagonist Therapeutics Inc. Common Stock,United States,2016,Health Care,Biotechnology: Pharmaceutical Preparations
PTLO,Portillo's Inc. Class A Common Stock,United States,2021,Consumer Discretionary,Restaurants
PTON,Peloton Interactive Inc. Class A Common Stock,United States,2019,Consumer Discretionary,Recreational Games/Products/Toys
PTVE,Pactiv Evergreen Inc. Common stock,United States,2020,Consumer Discretionary,Containers/Packaging
PUBM,PubMatic Inc. Class A Common Stock,United States,2020,Technology,Computer Software: Programming Data Processing
PUK,Prudential Public Limited Company Common Stock,United Kingdom,,Finance,Life Insurance
PUMP,ProPetro Holding Corp. Common Stock,United States,2017,Energy,Oilfield Services/Equipment
PVH,PVH Corp. Common Stock,United States,,Consumer Discretionary,Apparel
PWP,Perella Weinberg Partners Class A Common Stock,United States,2020,Finance,Finance: Consumer Services
PWR,Quanta Services Inc. Common Stock,United States,,Industrials,Engineering & Construction
PX,P10 Inc. Class A Common Stock,United States,2021,Finance,Investment Managers
PYCR,Paycor HCM Inc. Common Stock,United States,2021,Technology,Computer Software: Prepackaged Software
PYPL,PayPal Holdings Inc. Common Stock,United States,,Consumer Discretionary,Business Services
PZZA,Papa John's International Inc. Common Stock,United States,1993,Consumer Discretionary,Restaurants
QBTS,D-Wave Quantum Inc. Common Shares,,2022,Technology,EDP Services
QCOM,QUALCOMM Incorporated Common Stock,United States,1991,Technology,Radio And Television Broadcasting And Communications Equipment
QCRH,QCR Holdings Inc. Common Stock,United States,,Finance,Major Banks
QD,Qudian Inc. American Depositary Shares each representing one Class A Ordinary Share,China,2017,Finance,Finance: Consumer Services
QDEL,QuidelOrtho Corporation Common Stock,United States,,Health Care,Biotechnology: In Vitro & In Vivo Diagnostic Substances
QFIN,Qifu Technology Inc. American Depositary Shares,China,2018,Finance,Finance: Consumer Services
QGEN,Qiagen N.V. Common Shares,Netherlands,,Health Care,Biotechnology: Biological Products (No Diagnostic Substances)
QLYS,Qualys Inc. Common Stock,United States,2012,Technology,Computer Software: Prepackaged Software
QNST,QuinStreet Inc. Common Stock,United States,2010,Consumer Discretionary,Business Services
QRVO,Qorvo Inc. Common Stock,United States,,Technology,Semiconductors
QS,QuantumScape Corporation Class A Common Stock,United States,2020,Miscellaneous,Industrial Machinery/Components
QSR,Restaurant Brands International Inc. Common Shares,Canada,2014,Consumer Discretionary,Restaurants
QTWO,Q2 Holdings Inc. Common Stock,United States,2014,Technology,Computer Software: Prepackaged Software
QUAD,Quad Graphics Inc Class A Common Stock,United States,,Consumer Discretionary,Publishing
QUBT,Quantum Computing Inc. Common Stock,United States,,Technology,Computer Software: Prepackaged Software
QURE,uniQure N.V. Ordinary Shares,Netherlands,2014,Health Care,Biotechnology: Pharmaceutical Preparations
QXO,QXO Inc. Common Stock,United States,,Technology,EDP Services
R,Ryder System Inc. Common Stock,United States,,Consumer Discretionary,Rental/Leasing Companies
RACE,Ferrari N.V. Common Shares,Italy,2015,Consumer Discretionary,Auto Manufacturing
RAMP,LiveRamp Holdings Inc. Common Stock,United States,2018,Technology,EDP Services
RAPP,Rapport Therapeutics Inc. Common Stock,United States,2024,Health Care,Biotechnology: Pharmaceutical Preparations
RARE,Ultragenyx Pharmaceutical Inc. Common Stock,United States,2014,Health Care,Biotechnology: Pharmaceutical Preparations
RBA,RB Global Inc. Common Stock,Canada,,Consumer Discretionary,Business Services
RBB,RBB Bancorp Common Stock,United States,2017,Finance,Major Banks
RBBN,Ribbon Communications Inc. Common Stock,United States,,Technology,EDP Services
RBC,RBC Bearings Incorporated Common Stock,United States,2022,Industrials,Metal Fabrications
RBCAA,Republic Bancorp Inc. Class A Common Stock,United States,1998,Finance,Major Banks
RBLX,Roblox Corporation Class A Common Stock,United States,2021,Technology,Computer Software: Prepackaged Software
RBRK,Rubrik Inc. Class A Common Stock,United States,2024,Technology,Computer Software: Prepackaged Software
RC,Ready Capital Corporation Common Stock,United States,2013,Real Estate,Real Estate Investment Trusts
RCAT,Red Cat Holdings Inc. Common Stock,United States,,Technology,Computer Software: Prepackaged Software
RCB,Ready Capital Corporation 6.20% Senior Notes due 2026,United States,2019,Real Estate,Real Estate Investment Trusts
RCC,Ready Capital Corporation 5.75% Senior Notes due 2026,United States,2021,Real Estate,Real Estate Investment Trusts
RCI,Rogers Communication Inc. Common Stock,Canada,,Telecommunications,Cable & Other Pay Television Services
RCKT,Rocket Pharmaceuticals Inc. Common Stock,United States,2015,Health Care,Biotechnology: Pharmaceutical Preparations
RCL,Royal Caribbean Cruises Ltd. Common Stock,United States,1993,Consumer Discretionary,Marine Transportation
RCUS,Arcus Biosciences Inc. Common Stock,United States,2018,Health Care,Biotechnology: Pharmaceutical Preparations
RDDT,Reddit Inc. Class A Common Stock,United States,2024,Technology,EDP Services
RDFN,Redfin Corporation Common Stock,United States,2017,Finance,Real Estate
RDN,Radian Group Inc. Common Stock,United States,,Finance,Property-Casualty Insurers
RDNT,RadNet Inc. Common Stock,United States,,Health Care,Medical Specialities
RDUS,Radius Recycling Inc. Class A Common Stock,United States,,Consumer Discretionary,Industrial Specialties
RDVT,Red Violet Inc. Common Stock ,United States,,Technology,Computer Software: Prepackaged Software
RDW,Redwire Corporation Common Stock,United States,2021,Industrials,Military/Government/Technical
RDWR,Radware Ltd. Ordinary Shares,Israel,1999,Consumer Discretionary,Business Services
RDY,Dr. Reddy's Laboratories Ltd Common Stock,India,,Health Care,Biotechnology: Pharmaceutical Preparations
REAL,The RealReal Inc. Common Stock,United States,2019,Consumer Discretionary,Other Specialty Stores
REAX,The Real Brokerage Inc. Common Shares,Canada,,Finance,Real Estate
REFI,Chicago Atlantic Real Estate Finance Inc. Common Stock,United States,2021,Real Estate,Real Estate Investment Trusts
REG,Regency Centers Corporation Common Stock,United States,1993,Real Estate,Real Estate Investment Trusts
REGCO,Regency Centers Corporation 5.875% Series B Cumulative Redeemable Preferred Stock,United States,,Real Estate,Real Estate Investment Trusts
REGCP,Regency Centers Corporation 6.25% Series A Cumulative Redeemable Preferred Stock,United States,,Real Estate,Real Estate Investment Trusts
REGN,Regeneron Pharmaceuticals Inc. Common Stock,United States,1991,Health Care,Biotechnology: Pharmaceutical Preparations
RELX,RELX PLC PLC American Depositary Shares (Each representing One Ordinary Share),United Kingdom,2015,Consumer Discretionary,Business Services
RELY,Remitly Global Inc. Common Stock,United States,2021,Consumer Discretionary,Business Services
REPL,Replimune Group Inc. Common Stock,United States,2018,Health Care,Biotechnology: Biological Products (No Diagnostic Substances)
REPX,Riley Exploration Permian Inc. Common Stock,United States,1999,Energy,Oil & Gas Production
RERE,ATRenew Inc. American Depositary Shares (every three of which representing two Class A ordinary shares),Cayman Islands,2021,Consumer Discretionary,Other Specialty Stores
RES,RPC Inc. Common Stock,United States,,Energy,Oilfield Services/Equipment
REVG,REV Group Inc. Common Stock,United States,2017,Consumer Discretionary,Auto Manufacturing
REX,REX American Resources Corporation,United States,,Industrials,Major Chemicals
REXR,Rexford Industrial Realty Inc. Common Stock,United States,2013,Real Estate,Real Estate Investment Trusts
REYN,Reynolds Consumer Products Inc. Common Stock,United States,2020,Consumer Discretionary,Containers/Packaging
REZI,Resideo Technologies Inc. Common Stock ,United States,2018,Industrials,Wholesale Distributors
RF,Regions Financial Corporation Common Stock,United States,,Finance,Major Banks
RFI,Cohen & Steers Total Return Realty Fund Inc. Common Stock,United States,1993,Finance,Investment Managers
RFMZ,RiverNorth Flexible Municipal Income Fund II Inc. Common Stock,,2021,Finance,Trusts Except Educational Religious and Charitable
RGA,Reinsurance Group of America Incorporated Common Stock,United States,,Finance,Life Insurance
RGEN,Repligen Corporation Common Stock,United States,1986,Health Care,Biotechnology: Biological Products (No Diagnostic Substances)
RGLD,Royal Gold Inc. Common Stock,United States,,Industrials,Precious Metals
RGNX,REGENXBIO Inc. Common Stock,United States,2015,Health Care,Biotechnology: Biological Products (No Diagnostic Substances)
RGR,Sturm Ruger & Company Inc. Common Stock,United States,,Industrials,Ordnance And Accessories
RGTI,Rigetti Computing Inc. Common Stock,United States,,Technology,EDP Services
RGTIW,Rigetti Computing Inc. Warrants,United States,,Technology,EDP Services
RH,RH Common Stock,United States,2012,Consumer Discretionary,Other Specialty Stores
RHI,Robert Half Inc. Common Stock,United States,,Consumer Discretionary,Professional Services
RHLD,Resolute Holdings Management Common Stock ,United States,,Finance,Finance: Consumer Services
RHP,Ryman Hospitality Properties Inc. (REIT),United States,,Real Estate,Real Estate Investment Trusts
RICK,RCI Hospitality Holdings Inc. Common Stock,United States,1995,Consumer Discretionary,Restaurants
RIG,Transocean Ltd (Switzerland) Common Stock,Switzerland,,Energy,Oil & Gas Production
RIGL,Rigel Pharmaceuticals Inc. Common Stock,United States,2000,Health Care,Biotechnology: Pharmaceutical Preparations
RILYG,B. Riley Financial Inc. 5.00% Senior Notes due 2026,United States,,Finance,Investment Managers
RILYK,B. Riley Financial Inc. 5.50% Senior Notes Due 2026,United States,,Finance,Investment Managers
RILYN,B. Riley Financial Inc. 6.50% Senior Notes Due 2026,United States,,Finance,Investment Managers
RILYT,B. Riley Financial Inc. 6.00% Senior Notes Due 2028,United States,,Finance,Investment Managers
RILYZ,B. Riley Financial Inc. 5.25% Senior Notes due 2028,United States,,Finance,Investment Managers
RIO,Rio Tinto Plc Common Stock,Australia,2002,Basic Materials,Metal Mining
RIOT,Riot Platforms Inc. Common Stock ,United States,,Finance,Finance: Consumer Services
RITM,Rithm Capital Corp. Common Stock,United States,,Real Estate,Real Estate Investment Trusts
RIVN,Rivian Automotive Inc. Class A Common Stock,United States,2021,Consumer Discretionary,Auto Manufacturing
RJF,Raymond James Financial Inc. Common Stock,United States,,Finance,Investment Bankers/Brokers/Service
RKLB,Rocket Lab USA Inc. Common Stock,United States,2020,Industrials,Military/Government/Technical
RKT,Rocket Companies Inc. Class A Common Stock,United States,2020,Finance,Finance: Consumer Services
RL,Ralph Lauren Corporation Common Stock,United States,1997,Consumer Discretionary,Apparel
RLAY,Relay Therapeutics Inc. Common Stock,United States,2020,Health Care,Biotechnology: Biological Products (No Diagnostic Substances)
RLGT,Radiant Logistics Inc. Common Stock,United States,,Consumer Discretionary,Oil Refining/Marketing
RLI,RLI Corp. Common Stock (DE),United States,,Finance,Property-Casualty Insurers
RLJ,RLJ Lodging Trust Common Shares of Beneficial Interest $0.01 par value,United States,2011,Real Estate,Real Estate Investment Trusts
RLX,RLX Technology Inc. American Depositary Shares each representing the right to receive one (1) Class A ordinary share,Cayman Islands,2021,Health Care, Medicinal Chemicals and Botanical Products 
RM,Regional Management Corp. Common Stock,United States,2012,Finance,Finance: Consumer Services
RMBS,Rambus Inc. Common Stock,United States,1997,Technology,Semiconductors
RMD,ResMed Inc. Common Stock,United States,,Health Care,Medical/Dental Instruments
RMM,RiverNorth Managed Duration Municipal Income Fund Inc. Common Stock,,2019,Finance,Trusts Except Educational Religious and Charitable
RMMZ,RiverNorth Managed Duration Municipal Income Fund II Inc. Common Stock,,2022,Finance,Investment Managers
RMNI,Rimini Street Inc. (DE) Common Stock,United States,2015,Consumer Discretionary,Business Services
RMR,The RMR Group Inc. Class A Common Stock,United States,,Consumer Discretionary,Professional Services
RMT,Royce Micro-Cap Trust Inc. Common Stock,United States,,Finance,Investment Managers
RNA,Avidity Biosciences Inc. Common Stock,United States,2020,Health Care,Biotechnology: Pharmaceutical Preparations
RNAC,Cartesian Therapeutics Inc. Common Stock,United States,2016,Health Care,Biotechnology: Pharmaceutical Preparations
RNG,RingCentral Inc. Class A Common Stock,United States,2013,Technology,EDP Services
RNGR,Ranger Energy Services Inc. Class A Common Stock,United States,2017,Energy,Oilfield Services/Equipment
RNP,Cohen & Steers REIT and Preferred and Income Fund Inc. Common Shares,United States,2003,Finance,Investment Managers
RNR,RenaissanceRe Holdings Ltd. Common Stock,Bermuda,,Finance,Property-Casualty Insurers
RNST,Renasant Corporation Common Stock,United States,2023,Finance,Major Banks
RNW,ReNew Energy Global plc Class A Ordinary Shares,United Kingdom,,Utilities,Electric Utilities: Central
ROAD,Construction Partners Inc. Class A Common Stock,United States,2018,Industrials,Military/Government/Technical
ROCK,Gibraltar Industries Inc. Common Stock,United States,1993,Industrials,Steel/Iron Ore
ROG,Rogers Corporation Common Stock,United States,1960,Industrials,Major Chemicals
ROIV,Roivant Sciences Ltd. Common Shares,United Kingdom,,Health Care,Biotechnology: Pharmaceutical Preparations
ROK,Rockwell Automation Inc. Common Stock,United States,,Industrials,Industrial Machinery/Components
ROKU,Roku Inc. Class A Common Stock,United States,2017,Telecommunications,Cable & Other Pay Television Services
ROL,Rollins Inc. Common Stock,United States,,Finance,Diversified Commercial Services
ROOT,Root Inc. Class A Common Stock,United States,2020,Finance,Property-Casualty Insurers
ROP,Roper Technologies Inc. Common Stock,United States,1992,Industrials,Industrial Machinery/Components
ROST,Ross Stores Inc. Common Stock,United States,1985,Consumer Discretionary,Clothing/Shoe/Accessory Stores
RPAY,Repay Holdings Corporation Class A Common Stock,United States,2018,Consumer Discretionary,Business Services
RPD,Rapid7 Inc. Common Stock,United States,2015,Technology,Computer Software: Prepackaged Software
RPM,RPM International Inc. Common Stock,United States,,Consumer Discretionary,Paints/Coatings
RPRX,Royalty Pharma plc Class A Ordinary Shares ,United States,2020,Health Care,Biotechnology: Pharmaceutical Preparations
RQI,Cohen & Steers Quality Income Realty Fund Inc Common Shares,United States,2002,Finance,Trusts Except Educational Religious and Charitable
RRBI,Red River Bancshares Inc. Common Stock,United States,2019,Consumer Discretionary,Hotels/Resorts
RRC,Range Resources Corporation Common Stock,United States,,Energy,Oil & Gas Production
RRR,Red Rock Resorts Inc. Class A Common Stock,United States,2016,Consumer Discretionary,Hotels/Resorts
RRX,Regal Rexnord Corporation Common Stock,United States,1976,Consumer Discretionary,Metal Fabrications
RS,Reliance Inc. Common Stock,United States,1994,Industrials,Metal Fabrications
RSG,Republic Services Inc. Common Stock,United States,1998,Utilities,Environmental Services
RSI,Rush Street Interactive Inc. Class A Common Stock,United States,2020,Consumer Discretionary,Services-Misc. Amusement & Recreation
RSKD,Riskified Ltd. Class A Ordinary Shares,,2021,Consumer Discretionary,Business Services
RSVR,Reservoir Media Inc. Common Stock,United States,2021,Consumer Discretionary,Services-Misc. Amusement & Recreation
RTO,Rentokil Initial plc American Depositary Shares (each representing five (5) Ordinary Shares),United States,2022,Consumer Discretionary,Other Consumer Services
RTX,RTX Corporation Common Stock,United States,,Industrials,Aerospace
RUM,Rumble Inc. Class A Common Stock,United States,2021,Technology,Computer Software: Programming Data Processing
RUMBW,Rumble Inc. Warrant,United States,2021,Technology,Computer Software: Programming Data Processing
RUN,Sunrun Inc. Common Stock,United States,2015,Miscellaneous,Industrial Machinery/Components
