symbol,name,country,ipo_year,sector,industry
DTM,DT Midstream Inc. Common Stock ,United States,2021,Utilities,Natural Gas Distribution
DTW,DTE Energy Company 2017 Series E 5.25% Junior Subordinated Debentures due 2077,United States,2017,Utilities,Electric Utilities: Central
DUK,Duke Energy Corporation (Holding Company) Common Stock,United States,,Utilities,Power Generation
DUKB,Duke Energy Corporation 5.625% Junior Subordinated Debentures due 2078,United States,2018,Utilities,Power Generation
DUOL,Duolingo Inc. Class A Common Stock,United States,2021,Technology,Computer Software: Prepackaged Software
DV,DoubleVerify Holdings Inc. Common Stock,United States,2021,Technology,Computer Software: Programming Data Processing
DVA,DaVita Inc. Common Stock,United States,,Health Care,Misc Health and Biotechnology Services
DVAX,Dynavax Technologies Corporation Common Stock,United States,2004,Health Care,Biotechnology: Pharmaceutical Preparations
DVN,Devon Energy Corporation Common Stock,United States,1985,Energy,Oil & Gas Production
DX,Dynex Capital Inc. Common Stock,United States,,Real Estate,Real Estate Investment Trusts
DXC,DXC Technology Company Common Stock ,United States,,Technology,EDP Services
DXCM,DexCom Inc. Common Stock,United States,2005,Health Care,Medical/Dental Instruments
DXPE,DXP Enterprises Inc. Common Stock,United States,,Industrials,Industrial Machinery/Components
DY,Dycom Industries Inc. Common Stock,United States,,Industrials,Water Sewer Pipeline Comm & Power Line Construction
DYN,Dyne Therapeutics Inc. Common Stock,United States,2020,Health Care,Biotechnology: Pharmaceutical Preparations
E,ENI S.p.A. Common Stock,Italy,,Energy,Oil & Gas Production
EA,Electronic Arts Inc. Common Stock,United States,,Technology,Computer Software: Prepackaged Software
EAF,GrafTech International Ltd. Common Stock,United States,2018,Energy,Industrial Machinery/Components
EAI,Entergy Arkansas LLC First Mortgage Bonds 4.875% Series Due September 1 2066,United States,2016,Utilities,Electric Utilities: Central
EAT,Brinker International Inc. Common Stock,United States,,Consumer Discretionary,Restaurants
EBAY,eBay Inc. Common Stock,United States,1998,Consumer Discretionary,Business Services
EBC,Eastern Bankshares Inc. Common Stock,United States,2020,Finance,Savings Institutions
EBF,Ennis Inc. Common Stock,United States,,Consumer Discretionary,Office Equipment/Supplies/Services
EBR,Centrais Electricas Brasileiras S A American Depositary Shares (Each representing one Common Share),Brazil,2016,Utilities,Electric Utilities: Central
EBS,Emergent BioSolutions Inc. Common Stock,United States,2006,Health Care,Biotechnology: Pharmaceutical Preparations
EBTC,Enterprise Bancorp Inc Common Stock,United States,,Finance,Major Banks
EC,Ecopetrol S.A. American Depositary Shares,Colombia,,Energy,Oil & Gas Production
ECAT,BlackRock ESG Capital Allocation Term Trust Common Shares of Beneficial Interest,United States,2021,Finance,Trusts Except Educational Religious and Charitable
ECC           ,Eagle Point Credit Company Inc. Common Stock,United States,2014,Finance,Trusts Except Educational Religious and Charitable
ECCC,Eagle Point Credit Company Inc. 6.50% Series C Term Preferred Stock due 2031,United States,,Finance,Trusts Except Educational Religious and Charitable
ECCF,Eagle Point Credit Company Inc. 8.00% Series F Term Preferred Stock due 2029,United States,,,
ECCV,Eagle Point Credit Company Inc. 5.375% Notes due 2029,United States,2022,Finance,Trusts Except Educational Religious and Charitable
ECCW,Eagle Point Credit Company Inc. 6.75% Notes due 2031,United States,2021,Finance,Trusts Except Educational Religious and Charitable
ECCX,Eagle Point Credit Company Inc. 6.6875% Notes due 2028,United States,2022,Finance,Trusts Except Educational Religious and Charitable
ECG,Everus Construction Group Inc. Common Stock,United States,2024,Consumer Discretionary,Homebuilding
ECL,Ecolab Inc. Common Stock,United States,,Consumer Discretionary,Package Goods/Cosmetics
ECPG,Encore Capital Group Inc Common Stock,United States,,Finance,Finance Companies
ECVT,Ecovyst Inc. Common Stock,United States,2017,Industrials,Major Chemicals
ECX,ECARX Holdings Inc. Class A Ordinary shares,China,,Technology,EDP Services
ED,Consolidated Edison Inc. Common Stock,United States,,Utilities,Power Generation
EDN,Empresa Distribuidora Y Comercializadora Norte S.A. (Edenor) American Depositary Shares,Argentina,2007,Utilities,Electric Utilities: Central
EDR,Endeavor Group Holdings Inc. Class A Common Stock,United States,2021,Consumer Discretionary,Services-Misc. Amusement & Recreation
EDU,New Oriental Education & Technology Group Inc. Sponsored ADR representing 10 Ordinary Share (Cayman Islands),China,2006,Real Estate,Other Consumer Services
EE,Excelerate Energy Inc. Class A Common Stock,United States,2022,Utilities,Oil/Gas Transmission
EEFT,Euronet Worldwide Inc. Common Stock,United States,1997,Finance,Investment Bankers/Brokers/Service
EEX,Emerald Holding Inc. Common Stock,United States,2017,Consumer Discretionary,Business Services
EFC,Ellington Financial Inc. Common Stock ,United States,2010,Finance,Real Estate
EFSC,Enterprise Financial Services Corporation Common Stock,United States,,Finance,Major Banks
EFSCP,Enterprise Financial Services Corporation Depositary Shares Each Representing a 1/40th Interest in a Share of 5% Fixed Rate Non-Cumulative Perpetual Preferred Stock Series A,United States,,Finance,Major Banks
EFT,Eaton Vance Floating Rate Income Trust Common Shares of Beneficial Interest,United States,2004,Finance,Finance Companies
EFX,Equifax Inc. Common Stock,United States,,Finance,Finance: Consumer Services
EFXT,Enerflex Ltd Common Shares,Canada,2022,Industrials,Industrial Machinery/Components
EG,Everest Group Ltd. Common Stock,Bermuda,,Finance,Property-Casualty Insurers
EGBN,Eagle Bancorp Inc. Common Stock,United States,,Finance,Major Banks
EGHT,8x8 Inc Common Stock,United States,,Technology,EDP Services
EGY,VAALCO Energy Inc.  Common Stock,United States,,Energy,Oil & Gas Production
EH,EHang Holdings Limited ADS,China,2019,Industrials,Aerospace
EHAB,Enhabit Inc. Common Stock,United States,2022,Health Care,Medical/Nursing Services
EHC,Encompass Health Corporation Common Stock,United States,,Health Care,Hospital/Nursing Management
EIG,Employers Holdings Inc Common Stock,United States,2007,Finance,Property-Casualty Insurers
EIX,Edison International Common Stock,United States,,Utilities,Electric Utilities: Central
EL,Estee Lauder Companies Inc. (The) Common Stock,United States,1995,Consumer Discretionary,Package Goods/Cosmetics
ELAN,Elanco Animal Health Incorporated Common Stock,United States,2018,Health Care,Biotechnology: Pharmaceutical Preparations
ELC,Entergy Louisiana Inc. Collateral Trust Mortgage Bonds 4.875 % Series due September 1 2066,United States,2016,Utilities,Electric Utilities: Central
ELF,e.l.f. Beauty Inc. Common Stock,United States,2016,Consumer Discretionary,Package Goods/Cosmetics
ELME,Elme Communities Common Stock,United States,2000,Real Estate,Real Estate Investment Trusts
ELP,Companhia Paranaense de Energia (COPEL) American Depositary Shares (each representing one Unit consisting one Common Share and four non-voting Class B Preferred Shares),Brazil,2021,Utilities,Electric Utilities: Central
ELPC,Companhia Paranaense de Energia (COPEL) American Depositary Shares (each representing four (4) Common Shares),Brazil,2023,Utilities,Electric Utilities: Central
ELS,Equity Lifestyle Properties Inc. Common Stock,United States,,Real Estate,Real Estate Investment Trusts
ELV,Elevance Health Inc. Common Stock,United States,,Health Care,Medical Specialities
ELVN,Enliven Therapeutics Inc. Common Stock,United States,2020,Health Care,Biotechnology: Pharmaceutical Preparations
EMBC,Embecta Corp. Common Stock,United States,,Health Care,Medical/Dental Instruments
EME,EMCOR Group Inc. Common Stock,United States,,Industrials,Engineering & Construction
EMN,Eastman Chemical Company Common Stock,United States,,Industrials,Major Chemicals
EMP,Entergy Mississippi LLC First Mortgage Bonds 4.90% Series Due October 1 2066,United States,2016,Utilities,Electric Utilities: Central
EMR,Emerson Electric Company Common Stock,United States,,Technology,Consumer Electronics/Appliances
ENB,Enbridge Inc Common Stock,Canada,,Energy,Natural Gas Distribution
ENFN,Enfusion Inc. Class A Common Stock,United States,2021,Technology,Computer Software: Prepackaged Software
ENGN,enGene Holdings Inc. Common Stock,Canada,,Health Care,Biotechnology: Biological Products (No Diagnostic Substances)
ENIC,Enel Chile S.A. American Depositary Shares (Each representing 50 shares of Common Stock),Chile,2016,Utilities,Electric Utilities: Central
ENJ,Entergy New Orleans LLC First Mortgage Bonds 5.0% Series due December 1 2052,United States,,Utilities,Power Generation
ENLT,Enlight Renewable Energy Ltd. Ordinary Shares,Israel,2023,Utilities,Electric Utilities: Central
ENO,Entergy New Orleans LLC First Mortgage Bonds 5.50% Series due April 1 2066,United States,2016,Utilities,Power Generation
ENOV,Enovis Corporation Common Stock,United States,,Health Care,Industrial Specialties
ENPH,Enphase Energy Inc. Common Stock,United States,2012,Technology,Semiconductors
ENR,Energizer Holdings Inc. Common Stock,United States,2015,Miscellaneous,Industrial Machinery/Components
ENS,EnerSys Common Stock,United States,2004,Technology,Industrial Machinery/Components
ENSG,The Ensign Group Inc. Common Stock,United States,2007,Health Care,Hospital/Nursing Management
ENTG,Entegris Inc. Common Stock,United States,2000,Industrials,Plastic Products
ENVA,Enova International Inc. Common Stock,United States,2014,Finance,Finance: Consumer Services
ENVX,Enovix Corporation Common Stock,United States,2021,Miscellaneous,Industrial Machinery/Components
EOG,EOG Resources Inc. Common Stock,United States,,Energy,Oil & Gas Production
EOLS,Evolus Inc. Common Stock,United States,2018,Health Care,Biotechnology: Pharmaceutical Preparations
EOSE,Eos Energy Enterprises Inc. Class A Common Stock,United States,,Miscellaneous,Industrial Machinery/Components
EPAC,Enerpac Tool Group Corp. Common Stock,United States,,Technology,Industrial Machinery/Components
EPAM,EPAM Systems Inc. Common Stock,United States,2012,Technology,EDP Services
EPC,Edgewell Personal Care Company Common Stock,United States,,Consumer Discretionary,Package Goods/Cosmetics
EPD,Enterprise Products Partners L.P. Common Stock,United States,,Utilities,Natural Gas Distribution
EPR,EPR Properties Common Stock,United States,1997,Real Estate,Real Estate Investment Trusts
EPRT,Essential Properties Realty Trust Inc. Common Stock,United States,2018,Real Estate,Real Estate Investment Trusts
EQBK,Equity Bancshares Inc. Class A Common Stock,United States,,Finance,Major Banks
EQH,Equitable Holdings Inc. Common Stock,United States,2018,Finance,Specialty Insurers
EQIX,Equinix Inc. Common Stock REIT,United States,2000,Real Estate,Real Estate Investment Trusts
EQNR,Equinor ASA,Norway,,Energy,Integrated oil Companies
EQR,Equity Residential Common Shares of Beneficial Interest,United States,,Real Estate,Real Estate Investment Trusts
EQT,EQT Corporation Common Stock,United States,,Energy,Oil & Gas Production
EQX,Equinox Gold Corp. Common Shares,Canada,,Basic Materials,Precious Metals
ERAS,Erasca Inc. Common Stock,United States,2021,Health Care,Biotechnology: Pharmaceutical Preparations
ERIC,Ericsson American Depositary Shares,Sweden,,Technology,Radio And Television Broadcasting And Communications Equipment
ERIE,Erie Indemnity Company Class A Common Stock,United States,,Finance,Specialty Insurers
ERII,Energy Recovery Inc. Common Stock,United States,2008,Technology,Industrial Machinery/Components
ERJ,Embraer S.A. Common Stock,Brazil,2000,Industrials,Aerospace
ERO,Ero Copper Corp. Common Shares,Canada,2021,Basic Materials,Metal Mining
ES,Eversource Energy (D/B/A) Common Stock,United States,,Utilities,Electric Utilities: Central
ESAB,ESAB Corporation Common Stock,United States,2022,Industrials,Industrial Machinery/Components
ESE,ESCO Technologies Inc. Common Stock,United States,,Telecommunications,Telecommunications Equipment
ESGR,Enstar Group Limited Ordinary Shares,Bermuda,,Finance,Property-Casualty Insurers
ESGRO,Enstar Group Limited Depository Shares 7.00% Perpetual Non-Cumulative Preference Shares Series E,Bermuda,,Finance,Property-Casualty Insurers
ESGRP,Enstar Group Limited Depositary Shares Each Representing 1/1000th of an interest in Preference Shares,Bermuda,,Finance,Property-Casualty Insurers
ESI,Element Solutions Inc. Common Stock,United States,2014,Industrials,Major Chemicals
ESLT,Elbit Systems Ltd. Ordinary Shares,Israel,,Industrials,Military/Government/Technical
ESNT,Essent Group Ltd. Common Shares,Bermuda,2013,Finance,Property-Casualty Insurers
ESPR,Esperion Therapeutics Inc. Common Stock,United States,2013,Health Care,Biotechnology: Pharmaceutical Preparations
ESQ,Esquire Financial Holdings Inc. Common Stock,United States,2017,Finance,Commercial Banks
ESRT,Empire State Realty Trust Inc. Class A Common Stock,United States,2013,Real Estate,Real Estate Investment Trusts
ESS,Essex Property Trust Inc. Common Stock,United States,1994,Real Estate,Real Estate Investment Trusts
ESTA,Establishment Labs Holdings Inc. Common Shares,Costa Rica,2018,Health Care,Industrial Specialties
ESTC,Elastic N.V. Ordinary Shares,United States,2018,Technology,Computer Software: Prepackaged Software
ET,Energy Transfer LP Common Units ,United States,,Utilities,Natural Gas Distribution
ETB,Eaton Vance Tax-Managed Buy-Write Income Fund Eaton Vance Tax-Managed Buy-Write Income Fund Common Shares of Beneficial Interest,United States,2005,Finance,Investment Bankers/Brokers/Service
ETD,Ethan Allen Interiors Inc. Common Stock,United States,,Consumer Discretionary,Home Furnishings
ETN,Eaton Corporation PLC Ordinary Shares,Ireland,,Technology,Industrial Machinery/Components
ETNB,89bio Inc. Common Stock,United States,2019,Health Care,Biotechnology: Pharmaceutical Preparations
ETO,Eaton Vance Tax-Advantage Global Dividend Opp Common Stock,United States,2004,Finance,Investment Managers
ETON,Eton Pharmaceuticals Inc. Common Stock,United States,2018,Health Care,Biotechnology: Pharmaceutical Preparations
ETR,Entergy Corporation Common Stock,United States,,Utilities,Electric Utilities: Central
ETSY,Etsy Inc. Common Stock,United States,2015,Consumer Discretionary,Business Services
ETV,Eaton Vance Corporation Eaton Vance Tax-Managed Buy-Write Opportunities Fund Common Shares of Beneficial Interest,United States,2005,Finance,Investment Bankers/Brokers/Service
ETW,Eaton Vance Corporation Eaton Vance Tax-Managed Global Buy-Write Opportunites Fund Common Shares of Beneficial Interest,United States,2005,Finance,Investment Managers
ETWO,E2open Parent Holdings Inc.Class A Common Stock,United States,2020,Technology,EDP Services
EU,enCore Energy Corp. Common Shares,United States,,Basic Materials,Other Metals and Minerals
EVCM,EverCommerce Inc. Common Stock,United States,2021,Technology,Computer Software: Prepackaged Software
EVER,EverQuote Inc. Class A Common Stock,United States,2018,Technology,Computer Software: Programming Data Processing
EVEX,Eve Holding Inc. Common Stock,,2022,Industrials,Aerospace
EVGO,EVgo Inc. Class A Common Stock,United States,,Technology,EDP Services
EVH,Evolent Health Inc Class A Common Stock,United States,2015,Consumer Discretionary,Other Consumer Services
EVLV,Evolv Technologies Holdings Inc. Class A Common Stock,United States,2020,Technology,Computer peripheral equipment
EVN,Eaton Vance Municipal Income Trust Common Stock,United States,1999,Finance,Investment Managers
EVO,Evotec SE American Depositary Shares,Germany,2021,Health Care,Biotechnology: Pharmaceutical Preparations
EVR,Evercore Inc. Class A Common Stock,United States,2006,Finance,Investment Managers
EVRG,Evergy Inc. Common Stock,United States,,Utilities,Power Generation
EVRI,Everi Holdings Inc. Common Stock,United States,,Consumer Discretionary,Services-Misc. Amusement & Recreation
EVTC,Evertec Inc. Common Stock,Puerto Rico,2013,Technology,EDP Services
EW,Edwards Lifesciences Corporation Common Stock,United States,,Health Care,Industrial Specialties
EWBC,East West Bancorp Inc. Common Stock,United States,,Finance,Major Banks
EWCZ,European Wax Center Inc. Class A Common Stock,United States,2021,Consumer Discretionary,Other Consumer Services
EWTX,Edgewise Therapeutics Inc. Common Stock,United States,2021,Health Care,Biotechnology: Pharmaceutical Preparations
EXAS,Exact Sciences Corporation Common Stock,United States,2001,Health Care,Medical Specialities
EXC,Exelon Corporation Common Stock,United States,,Utilities,Power Generation
EXE,Expand Energy Corporation Common Stock,United States,,Energy,Oil & Gas Production
EXEEL,Expand Energy Corporation Class C Warrants,United States,,Energy,Oil & Gas Production
EXEEW,Expand Energy Corporation Class A Warrants,United States,,Energy,Oil & Gas Production
EXEEZ,Expand Energy Corporation Class B Warrants,United States,,Energy,Oil & Gas Production
EXEL,Exelixis Inc. Common Stock,United States,2000,Health Care,Biotechnology: Biological Products (No Diagnostic Substances)
EXFY,Expensify Inc. Class A Common Stock,United States,2021,Technology,Computer Software: Prepackaged Software
EXK,Endeavour Silver Corporation Ordinary Shares (Canada),Canada,,Basic Materials,Precious Metals
EXLS,ExlService Holdings Inc. Common Stock,United States,2006,Consumer Discretionary,Business Services
EXOD,Exodus Movement Inc. Class A Common Stock,,,Finance,Finance: Consumer Services
EXP,Eagle Materials Inc Common Stock,United States,,Industrials,Building Materials
EXPD,Expeditors International of Washington Inc. Common Stock,United States,,Consumer Discretionary,Oil Refining/Marketing
EXPE,Expedia Group Inc. Common Stock,United States,,Consumer Discretionary,Transportation Services
EXPI,eXp World Holdings Inc. Common Stock,United States,,Finance,Real Estate
EXPO,Exponent Inc. Common Stock,United States,,Consumer Discretionary,Professional Services
EXR,Extra Space Storage Inc Common Stock,United States,2004,Real Estate,Real Estate Investment Trusts
EXTR,Extreme Networks Inc. Common Stock,United States,1999,Telecommunications,Computer Communications Equipment
EYE,National Vision Holdings Inc. Common Stock,United States,2017,Health Care,Ophthalmic Goods
EYPT,EyePoint Pharmaceuticals Inc. Common Stock,United States,,Industrials,Biotechnology: Laboratory Analytical Instruments
EZPW,EZCORP Inc. Class A Non Voting Common Stock,United States,1991,Consumer Discretionary,Other Specialty Stores
F,Ford Motor Company Common Stock,United States,,Consumer Discretionary,Auto Manufacturing
FA,First Advantage Corporation Common Stock,United States,2021,Consumer Discretionary,Business Services
FAF,First American Corporation (New) Common Stock,United States,,Finance,Specialty Insurers
FANG,Diamondback Energy Inc. Common Stock,United States,2012,Energy,Oil & Gas Production
FARO,FARO Technologies Inc. Common Stock,United States,1997,Industrials,Industrial Machinery/Components
FAST,Fastenal Company Common Stock,United States,1987,Consumer Discretionary,RETAIL: Building Materials
FBIN,Fortune Brands Innovations Inc. Common Stock,United States,,Basic Materials,Forest Products
FBIZ,First Business Financial Services Inc. Common Stock,United States,,Finance,Major Banks
FBK,FB Financial Corporation Common Stock,United States,2016,Finance,Major Banks
FBMS,First Bancshares Inc.,United States,,Finance,Major Banks
FBNC,First Bancorp Common Stock,United States,1987,Finance,Major Banks
FBP,First BanCorp. New Common Stock,Puerto Rico,,Finance,Major Banks
FBRT,Franklin BSP Realty Trust Inc. Common Stock,United States,2021,Real Estate,Real Estate Investment Trusts
FBYD,Falcon's Beyond Global Inc. Class A Common Stock,United States,,Consumer Discretionary,Services-Misc. Amusement & Recreation
FC,Franklin Covey Company Common Stock,United States,,Consumer Discretionary,Other Consumer Services
FCBC,First Community Bankshares Inc. (VA) Common Stock,United States,,Finance,Major Banks
FCF,First Commonwealth Financial Corporation Common Stock,United States,,Finance,Major Banks
FCFS,FirstCash Holdings Inc. Common Stock,United States,1991,Consumer Discretionary,Other Specialty Stores
FCN,FTI Consulting Inc. Common Stock,United States,1999,Consumer Discretionary,Professional Services
FCNCA,First Citizens BancShares Inc. Class A Common Stock,United States,,Finance,Major Banks
FCNCO,First Citizens BancShares Inc. 5.625% Non-Cumulative Perpetual Preferred Stock Series C,United States,,Finance,Major Banks
FCNCP,First Citizens BancShares Inc. Depositary Shares,United States,,Finance,Major Banks
FCPT,Four Corners Property Trust Inc. Common Stock,United States,2015,Real Estate,Real Estate Investment Trusts
FCRX,Crescent Capital BDC Inc. 5.00% Notes due 2026,United States,2023,Finance,Finance: Consumer Services
FCX,Freeport-McMoRan Inc. Common Stock,United States,,Basic Materials,Metal Mining
FDP,Fresh Del Monte Produce Inc. Common Stock,Cayman Islands,1997,Consumer Staples,Farming/Seeds/Milling
FDS,FactSet Research Systems Inc. Common Stock,United States,2000,Technology,Computer Software: Programming Data Processing
FDUS,Fidus Investment Corporation Common Stock,United States,2011,Finance,Finance/Investors Services
FDX,FedEx Corporation Common Stock,United States,,Consumer Discretionary,Air Freight/Delivery Services
FE,FirstEnergy Corp. Common Stock,United States,,Utilities,Electric Utilities: Central
FELE,Franklin Electric Co. Inc. Common Stock,United States,,Consumer Discretionary,Metal Fabrications
FER,Ferrovial SE Ordinary Shares,Netherlands,,Industrials,Military/Government/Technical
FERG,Ferguson Enterprises Inc. Common Stock,United Kingdom,2021,Miscellaneous,Miscellaneous
FFBC,First Financial Bancorp. Common Stock,United States,,Finance,Major Banks
FFIC,Flushing Financial Corporation Common Stock,United States,,Finance,Major Banks
FFIN,First Financial Bankshares Inc. Common Stock,United States,,Finance,Major Banks
FFIV,F5 Inc. Common Stock,United States,1999,Telecommunications,Computer Communications Equipment
FFWM,First Foundation Inc. Common Stock,United States,,Finance,Major Banks
FG,F&G Annuities & Life Inc. Common Stock,United States,2022,Finance,Life Insurance
FGN,F&G Annuities & Life Inc. 7.950% Senior Notes due 2053,United States,2023,Finance,Life Insurance
FHB,First Hawaiian Inc. Common Stock,United States,2016,Finance,Major Banks
FHI,Federated Hermes Inc. Common Stock,United States,,Finance,Investment Managers
FHN,First Horizon Corporation Common Stock,United States,,Finance,Major Banks
FI,Fiserv Inc. Common Stock,United States,,Consumer Discretionary,Business Services
FIBK,First Interstate BancSystem Inc. Common Stock (DE),United States,2010,Finance,Major Banks
FICO,Fair Isaac Corporation Common Stock,United States,,Consumer Discretionary,Business Services
FIGS,FIGS Inc. Class A Common Stock,United States,2021,Consumer Discretionary,Apparel
FIHL,Fidelis Insurance Holdings Limited Common Shares,Bermuda,2023,Finance,Property-Casualty Insurers
FINS,Angel Oak Financial Strategies Income Term Trust Common Shares of Beneficial Interest,,2019,Finance,Finance/Investors Services
FINV,FinVolution Group American Depositary Shares,United States,2017,Finance,Finance: Consumer Services
FIP,FTAI Infrastructure Inc. Common Stock ,United States,,Energy,Oil Refining/Marketing
FIS,Fidelity National Information Services Inc. Common Stock,United States,,Consumer Discretionary,Business Services
FISI,Financial Institutions Inc. Common Stock,United States,1999,Finance,Major Banks
FITB,Fifth Third Bancorp Common Stock,United States,,Finance,Major Banks
FITBI,Fifth Third Bancorp Depositary Shares,United States,,Finance,Major Banks
FITBO,Fifth Third Bancorp Depositary Shares each representing a 1/1000th ownership interest in a share of Non-Cumulative Perpetual Preferred Stock Series K,United States,,Finance,Major Banks
FITBP,Fifth Third Bancorp Depositary Shares each representing 1/40th share of Fifth Third 6.00% Non-Cumulative Perpetual Class B Preferred Stock Series A,United States,,Finance,Major Banks
FIVE,Five Below Inc. Common Stock,United States,2012,Consumer Discretionary,Department/Specialty Retail Stores
FIVN,Five9 Inc. Common Stock,United States,2014,Technology,EDP Services
FIX,Comfort Systems USA Inc. Common Stock,United States,1997,Industrials,Engineering & Construction
FIZZ,National Beverage Corp. Common Stock,United States,,Consumer Staples,Beverages (Production/Distribution)
FL,Foot Locker Inc.,United States,,Consumer Discretionary,Clothing/Shoe/Accessory Stores
FLEX,Flex Ltd. Ordinary Shares,Singapore,1994,Technology,Electrical Products
FLG,Flagstar Financial Inc. Common Stock,United States,,Finance,Banks
FLGT,Fulgent Genetics Inc. Common Stock,United States,2016,Health Care,Medical Specialities
FLNC,Fluence Energy Inc. Class A Common Stock,United States,2021,Miscellaneous,Industrial Machinery/Components
FLNG,FLEX LNG Ltd. Ordinary Shares,,2019,Consumer Discretionary,Marine Transportation
FLO,Flowers Foods Inc. Common Stock,United States,,Consumer Staples,Packaged Foods
FLOC,Flowco Holdings Inc. Class A Common Stock,,2025,Industrials,Metal Fabrications
FLR,Fluor Corporation Common Stock,United States,,Industrials,Military/Government/Technical
FLS,Flowserve Corporation Common Stock,United States,,Industrials,Fluid Controls
FLUT,Flutter Entertainment plc Ordinary Shares,,2024,Technology,Computer Software: Programming Data Processing
FLWS,1-800-FLOWERS.COM Inc. Common Stock,United States,1999,Consumer Discretionary,Other Specialty Stores
FLX,BingEx Limited American Depositary Shares,China,2024,Industrials,Trucking Freight/Courier Services
